[
  {
    "schema_version": "1.0",
    "telemetry_id": "tel_001",
    "timestamp_utc": "2026-07-07T10:20:00Z",
    "tenant_id": "tenant_alpha",
    "project_id": "project_river_001",
    "profile_id": "profile_noir",
    "profile_tier": "pro",
    "cache_state": "warm",
    "command_type": "/style chain",
    "chain_id": "chain_001",
    "pipeline_name": "ghost_to_caveman_to_proofread",
    "stage": "ghost.apply",
    "handler": "ghost_apply",
    "registry_schema_version": "1.1.0",
    "runtime_version": "river_0.1.0",
    "platform": "shell",
    "status": "completed",
    "latency_ms": 420,
    "queue_wait_ms": 30,
    "execution_ms": 390,
    "rollback_applied": false,
    "validation_failed": false,
    "migration_applied": false,
    "unsupported_registry_blocked": false,
    "retry_count": 0,
    "correlation_id": "inc_shell_chain_001"
  },
  {
    "schema_version": "1.0",
    "telemetry_id": "tel_002",
    "timestamp_utc": "2026-07-07T10:20:01Z",
    "tenant_id": "tenant_alpha",
    "project_id": "project_river_001",
    "profile_id": "profile_noir",
    "profile_tier": "pro",
    "cache_state": "warm",
    "command_type": "/style chain",
    "chain_id": "chain_001",
    "pipeline_name": "ghost_to_caveman_to_proofread",
    "stage": "caveman.rewrite",
    "handler": "caveman_rewrite",
    "registry_schema_version": "1.1.0",
    "runtime_version": "river_0.1.0",
    "platform": "shell",
    "status": "completed",
    "latency_ms": 610,
    "queue_wait_ms": 40,
    "execution_ms": 570,
    "rollback_applied": false,
    "validation_failed": false,
    "migration_applied": false,
    "unsupported_registry_blocked": false,
    "retry_count": 0,
    "correlation_id": "inc_shell_chain_001"
  },
  {
    "schema_version": "1.0",
    "telemetry_id": "tel_003",
    "timestamp_utc": "2026-07-07T10:20:02Z",
    "tenant_id": "tenant_alpha",
    "project_id": "project_river_001",
    "profile_id": "profile_noir",
    "profile_tier": "pro",
    "cache_state": "warm",
    "command_type": "/style chain",
    "chain_id": "chain_001",
    "pipeline_name": "ghost_to_caveman_to_proofread",
    "stage": "proofread.run",
    "handler": "proofread_run",
    "registry_schema_version": "1.1.0",
    "runtime_version": "river_0.1.0",
    "platform": "shell",
    "status": "completed",
    "latency_ms": 250,
    "queue_wait_ms": 10,
    "execution_ms": 240,
    "rollback_applied": false,
    "validation_failed": false,
    "migration_applied": false,
    "unsupported_registry_blocked": false,
    "retry_count": 0,
    "correlation_id": "inc_shell_chain_001"
  },
  {
    "schema_version": "1.0",
    "telemetry_id": "tel_004",
    "timestamp_utc": "2026-07-07T10:22:00Z",
    "tenant_id": "tenant_alpha",
    "project_id": "project_river_002",
    "profile_id": "profile_legacy",
    "profile_tier": "starter",
    "cache_state": "cold",
    "command_type": "/style chain",
    "chain_id": "chain_002",
    "pipeline_name": "ghost_to_caveman_to_proofread",
    "stage": "registry.validate",
    "handler": "registry_validator",
    "registry_schema_version": "1.0.0",
    "runtime_version": "river_0.1.0",
    "platform": "shell",
    "status": "migrated",
    "latency_ms": 180,
    "queue_wait_ms": 5,
    "execution_ms": 175,
    "rollback_applied": false,
    "validation_failed": false,
    "migration_applied": true,
    "unsupported_registry_blocked": false,
    "retry_count": 0,
    "correlation_id": "inc_shell_chain_002"
  },
  {
    "schema_version": "1.0",
    "telemetry_id": "tel_005",
    "timestamp_utc": "2026-07-07T10:22:01Z",
    "tenant_id": "tenant_alpha",
    "project_id": "project_river_002",
    "profile_id": "profile_legacy",
    "profile_tier": "starter",
    "cache_state": "cold",
    "command_type": "/style chain",
    "chain_id": "chain_002",
    "pipeline_name": "ghost_to_caveman_to_proofread",
    "stage": "ghost.apply",
    "handler": "ghost_apply",
    "registry_schema_version": "1.1.0",
    "runtime_version": "river_0.1.0",
    "platform": "shell",
    "status": "completed",
    "latency_ms": 940,
    "queue_wait_ms": 180,
    "execution_ms": 760,
    "rollback_applied": false,
    "validation_failed": false,
    "migration_applied": true,
    "unsupported_registry_blocked": false,
    "retry_count": 1,
    "correlation_id": "inc_shell_chain_002"
  },
  {
    "schema_version": "1.0",
    "telemetry_id": "tel_006",
    "timestamp_utc": "2026-07-07T10:22:03Z",
    "tenant_id": "tenant_alpha",
    "project_id": "project_river_002",
    "profile_id": "profile_legacy",
    "profile_tier": "starter",
    "cache_state": "cold",
    "command_type": "/style chain",
    "chain_id": "chain_002",
    "pipeline_name": "ghost_to_caveman_to_proofread",
    "stage": "caveman.rewrite",
    "handler": "caveman_rewrite",
    "registry_schema_version": "1.1.0",
    "runtime_version": "river_0.1.0",
    "platform": "shell",
    "status": "failed",
    "latency_ms": 1800,
    "queue_wait_ms": 220,
    "execution_ms": 1580,
    "rollback_applied": true,
    "validation_failed": true,
    "migration_applied": true,
    "unsupported_registry_blocked": false,
    "retry_count": 2,
    "correlation_id": "inc_shell_chain_002"
  },
  {
    "schema_version": "1.0",
    "telemetry_id": "tel_007",
    "timestamp_utc": "2026-07-07T10:24:00Z",
    "tenant_id": "tenant_beta",
    "project_id": "project_river_003",
    "profile_id": "profile_unknown",
    "profile_tier": "enterprise",
    "cache_state": "unknown",
    "command_type": "/ghost apply",
    "chain_id": "chain_003",
    "pipeline_name": "ghost_only",
    "stage": "registry.validate",
    "handler": "registry_validator",
    "registry_schema_version": "2.0.0",
    "runtime_version": "river_0.1.0",
    "platform": "shell",
    "status": "blocked",
    "latency_ms": 90,
    "queue_wait_ms": 0,
    "execution_ms": 90,
    "rollback_applied": false,
    "validation_failed": true,
    "migration_applied": false,
    "unsupported_registry_blocked": true,
    "retry_count": 0,
    "correlation_id": "inc_shell_chain_003"
  }
]
